{"content_sha256":"bb7996f4a5446df2908a4f0a74cc533a4bb489cd8b6ed9407dd32491dffa895f","coverage_categories":{"cascade":["east_v5.validators.cross_table","east_v5.validators.table"],"code_value":["east_v5.validators.field"],"comparison":["east_v5.validators.cross_table","east_v5.validators.table"],"conditional_required":["east_v5.validators.cross_table","east_v5.validators.table"],"cross_record":["east_v5.validators.cross_table","east_v5.validators.field","east_v5.validators.table"],"format":["east_v5.validators.field"],"null":["east_v5.validators.field"],"range":["east_v5.validators.field"],"reference":["east_v5.validators.cross_table"],"type":["east_v5.validators.field"]},"rule_kind_index":{"CODE_DOMAIN":["east_v5.validators.field"],"COMPARISON":["east_v5.validators.table"],"CONDITIONAL_COMPARISON":["east_v5.validators.cross_table","east_v5.validators.table"],"CONDITIONAL_VALUE_EXCLUSION":["east_v5.validators.cross_table","east_v5.validators.table"],"DATA_TYPE":["east_v5.validators.field"],"ENCODING_RULE":["east_v5.validators.field"],"FORBIDDEN_CHARACTER_SET":["east_v5.validators.field"],"FORBIDDEN_VALUE":["east_v5.validators.field"],"NULLABLE":["east_v5.validators.field"],"PRIMARY_KEY":["east_v5.validators.field"],"REFERENCE_EXISTENCE":["east_v5.validators.cross_table"],"STRING_LENGTH":["east_v5.validators.field"],"UNIQUE":["east_v5.validators.field"],"VALUE_RANGE":["east_v5.validators.field"]},"schema_version":"v5.validator-registry/v1","validators":[{"asset_version":"CA-V0.2.0","layer":"field","rule_kinds":["CODE_DOMAIN","DATA_TYPE","ENCODING_RULE","FORBIDDEN_CHARACTER_SET","FORBIDDEN_VALUE","NULLABLE","PRIMARY_KEY","STRING_LENGTH","UNIQUE","VALUE_RANGE"],"validator_id":"east_v5.validators.field"},{"asset_version":"CA-V0.3.0","layer":"table","rule_kinds":["COMPARISON","CONDITIONAL_COMPARISON","CONDITIONAL_VALUE_EXCLUSION"],"validator_id":"east_v5.validators.table"},{"asset_version":"CA-V0.3.0","layer":"cross_table","rule_kinds":["CONDITIONAL_COMPARISON","CONDITIONAL_VALUE_EXCLUSION","REFERENCE_EXISTENCE"],"validator_id":"east_v5.validators.cross_table"}]}
